req_id,category,subcategory,requirement_text,target_value,test_module,test_function,validation_method,status,priority,phase,notes,effort_weeks,dependencies,blocks,assignee,sprint,started_date,completed_date,requirement_file,external_id,
REQ-ZT-001,ZERO_TRUST,AUTH,RTMX CLI shall integrate with Zitadel for OIDC PKCE authentication,Login flow works,tests/test_auth.py,TestOIDCFlow,Integration Test,MISSING,HIGH,10,Zitadel OIDC with PKCE flow and keychain token storage,3.0,REQ-COLLAB-001,REQ-ZT-002|REQ-ZT-003|REQ-COLLAB-003,,,,,docs/requirements/ZERO_TRUST/REQ-ZT-001.md,,
REQ-ZT-002,ZERO_TRUST,NETWORK,rtmx-sync shall be deployed as OpenZiti dark service with no public ports,Dark service runs,tests/test_ziti.py,TestDarkService,Integration Test,MISSING,HIGH,10,Zero-trust network overlay with identity-based access,3.5,REQ-ZT-001,REQ-ZT-003,,,,,docs/requirements/ZERO_TRUST/REQ-ZT-002.md,,
REQ-ZT-003,ZERO_TRUST,JWT,rtmx-sync shall validate JWTs on every request for authorization,JWT validation works,tests/test_jwt.py,TestJWTValidation,Unit Test,MISSING,HIGH,10,Stateless JWT validation with JWKS caching,2.0,REQ-ZT-001|REQ-ZT-002,REQ-COLLAB-002|REQ-COLLAB-003,,,,,docs/requirements/ZERO_TRUST/REQ-ZT-003.md,,
REQ-VERIFY-001,SECURITY,PROPERTY_TEST,RTMX shall have property-based tests using Hypothesis for access control invariants,Property tests pass,tests/property/test_access_control.py,TrustFederationMachine,Analysis,MISSING,HIGH,13,Stateful property testing for trust federation,2.5,REQ-COLLAB-003|REQ-ZT-003,REQ-VERIFY-004,,,,,docs/requirements/SECURITY/REQ-VERIFY-001.md,,
REQ-VERIFY-002,SECURITY,FORMAL,RTMX shall have TLA+ formal specification for trust federation protocol,TLC verifies spec,specs/TrustFederation.tla,,Analysis,MISSING,MEDIUM,13,Formal verification with TLA+ and TLAPS,3.0,REQ-COLLAB-003|REQ-ZT-003,REQ-VERIFY-004,,,,,docs/requirements/SECURITY/REQ-VERIFY-002.md,,
REQ-VERIFY-003,SECURITY,CHAOS,RTMX shall have chaos engineering tests for network fault tolerance,Chaos tests pass,tests/chaos/test_network_partition.py,test_offline_access_preserved,Integration Test,MISSING,MEDIUM,13,Toxiproxy-based chaos testing for partition tolerance,2.5,REQ-ZT-003|REQ-VERIFY-001,REQ-VERIFY-004,,,,,docs/requirements/SECURITY/REQ-VERIFY-003.md,,
REQ-VERIFY-004,SECURITY,COMPLIANCE,RTMX shall provide NIST 800-53 compliance mapping with automated evidence,Compliance report generated,tests/compliance/test_ac_2_account_management.py,TestAC2AccountManagement,Analysis,MISSING,MEDIUM,13,NIST 800-53 AC control mapping with automated compliance tests,3.0,REQ-VERIFY-001|REQ-VERIFY-002|REQ-VERIFY-003,,,,,,docs/requirements/SECURITY/REQ-VERIFY-004.md,,
